{
  "call_id": "TEST_RETELL_001",
  "agent_id": "truemate-health-agent",
  "agent_name": "Sofia",
  "started_at": "2026-09-07T21:00:00-04:00",
  "duration_seconds": 96,
  "direction": "outbound",
  "language": "es",
  "transcript": "Agente: Mucho gusto. Soy Sofia, agente del mercado de seguros de salud. ¿Tienes un minuto?\nCliente: Sí, pero ya tengo seguro médico por mi trabajo.\nAgente: Perfecto. ¿Actualmente tienes seguro médico?\nCliente: Sí, te acabo de decir que lo tengo por mi trabajo.\nAgente: Entiendo. ¿Te interesa revisar cobertura dental o de hospitalización?\nCliente: No, gracias.\nAgente: De acuerdo, muchas gracias por tu tiempo. Que tengas un buen día.",
  "recording_url": null,
  "disconnection_reason": "agent_hangup",
  "retell_metadata": {
    "source": "sample_only"
  }
}
